Job Title,Salary Estimate,Job Description,Rating,Company Name,Location,Headquarters,Size,Founded,Type of ownership,Industry,Sector,Revenue,Competitors
Spark/Big Data Engineer,$52K - $101K (Glassdoor est.),"The Data Consumption team of Decision Sciences and Transformation (DSaT) is seeking a highly motivated Spark / Big Data Developer to start or continue an IT career on the Big Data Platform project. Teaming up with architects, scrum masters, leads, managers and directors, you will work in an Agile environment to make the data on the Big Data Platform accessible for the needs of the organization through Atomic Models and Analytical Data Stores. In this role, you will coordinate with a variety of IT departments to elicit and translate high level business requirements into detailed system requirements. You will participate in the entire software development lifecycle by writing and executing test plans, finding solutions to issues during development and after deployment. You should be intellectually curious, have a solutions-oriented attitude and enjoy learning new tools and techniques.
Basic Qualifications:
At least two years of experience with SQL and Java or Scala
Experience with manipulating and transforming data
Exposure to NoSQL databases, Spark and the Hadoop Ecosystem (MapReduce, Oozie, Hive, Pig)
Strong critical thinking, decision making, and problem-solving skills
Excellent verbal/written communication skills, including communicating technical issues to non-technical audiences
Bachelor’s degree in a computer related field or equivalent professional experience required
Preferred Qualifications:
Experience in designing efficient and robust ETL/ELT workflows, schedulers, and event-based triggers
Experience with Spark core and Spark SQL
Experience as a Big Data Developer
Exposure to Data Mining, Data Engineering and Data Modeling
Exposure to Graph Databases
Note: The safety of our associates, both current and future, is GEICO’s highest priority. At this time, most of our associates are working remotely due to the current COVID-19 pandemic. Candidates who are selected for this position will be trained remotely and must be able to work from home in a designated work area. Once GEICO determines it is safe for associates to return to the office, candidates may be required to work in our Chevy Chase, MD office.
Benefits:
As Spark/Big Data Developer, you’ll enjoy our Total Rewards Program* to help secure your financial future and preserve your health and well-being, including:
Premier Medical, Dental and Vision Insurance with no waiting period**
Paid Vacation, Sick and Parental Leave
401(k) Plan with Profit Sharing
Tuition Reimbursement
Paid Training and Licensures
Benefits may be different by location. Benefit eligibility requirements vary and may include length of service.
**Coverage begins with the pay period after hire date. Must enroll in New Hire Benefits within 30 days of the date of hire for coverage to take effect.
The equal employment opportunity policy of the GEICO Companies provides for a fair and equal employment opportunity for all associates and job applicants regardless of race, color, religious creed, national origin, ancestry, age, gender, pregnancy, sexual orientation, gender identity, marital status, familial status, disability or genetic information, in compliance with applicable federal, state and local law. GEICO hires and promotes individuals solely on the basis of their qualifications for the job to be filled.
GEICO reasonably accommodates qualified individuals with disabilities to enable them to receive equal employment opportunity and/or perform the essential functions of the job, unless the accommodation would impose an undue hardship to the Company. This applies to all applicants and associates. GEICO also provides a work environment in which each associate is able to be productive and work to the best of their ability. We do not condone or tolerate an atmosphere of intimidation or harassment. We expect and require the cooperation of all associates in maintaining an atmosphere free from discrimination and harassment with mutual respect by and for all associates and applicants.
#LI-MW1",3.5,"GEICO
3.5","Chevy Chase, MD",-1,10000+ Employees,1936,Subsidiary or Business Segment,Insurance Carriers,Insurance,$10+ billion (USD),-1
Data Analyst,$40K - $73K (Glassdoor est.),"This position will be responsible for the development and maintenance of the company’s data analytic platform enabling business units to make decisions and achieve better outcomes for the company. A key partner promoting collaboration with cross-functional teams to design innovating reporting capabilities that provide key insights into cloud adoption, quality metrics and business KPI’s. The successful candidate must have knowledge of Business Intelligence, Data Warehousing, ETL database functionality and data modelling; effectively handle multiple work assignments, while consistently deliver high quality work; and will apply their experience in analytics, data visualization and modeling to find solutions for a variety of business and technical problems; querying and analyzing small and large data sets to discover patterns and deliver meaningful insights; and demonstrated ability to self-organize and prioritize multiple time-sensitive tasks on a daily basis.
Essential Functions and Responsibilities:
Azure Analysis Services - Tabular Modeling with development experience in Perspectives, Partitions and Design Aggregations
Tabular Object Model (TOM), Analysis Management Object (AMO), Tabular Model Scripting Language (TMSL)
Data Preparation, Profiling and ELT in the context of Tabular Model; Performance tuning of Tabular Models
Experience with Power BI including visualization parameters, report optimization creating measures, Power BI modeling, Power BI Reports/Dashboards and SQL Reporting Services
Understands high level technical solution & develop solution/code using Azure technology
Development in Azure Data Factory including Pipelines, Datasets, and Data Flows
Experience in development with data warehousing platforms
Setup and Configure CI/CD pipelines using Azure DevOps
Azure DevOps and Azure IaaS / PaaS environments
Visual Studio and SQL Management Studio
Azure SQL Database platforms including Azure SQL, and SQL Managed Instance
Analysis Services row-level security and bi-directional relationships
MDX, DAX, XMLA
Handling Historical Data
Interested in learning new technologies, creative, open-minded and a great team player
Adept at task switching to handle varying workload
Additional Functions and Responsibilities
Work with System Testing and UAT teams to analyze and resolve opened defects
Ability to do activities from Development to Deployment. Should be able to Code, Unit Test & Deploy
Assists with other tasks and projects as requested
Knowledge/Skills/Abilities
Forward thinking information professional with a proven, in depth understanding of analytical and statistical approaches to transform the way in which data is translated into actionable intelligence while encompassing a customer focused culture.
Proven experience in application development product delivery and project management with demonstrated skills in relationship building, negotiation, conflict resolution, agile leadership/mindset, and project management of multi-function teams.
Ability to be able to learn quickly, always improving existing skills and developing new ones. Team working, helpful, open, and willing to share knowledge with colleagues
Education & Background
Bachelor’s degree in Computer Science, Information Technology, or equivalent work experience.
4+ years of experience in designing, deploying, and maintaining SQL Server infrastructures.
Azure SQL and Analytics Platforms
ETL data integration with external data sources and SQL Server.
Demonstrate a strong understanding of a range of BI tools, analysis techniques and visualization technologies, and be comfortable dealing with clients at all levels.
Excellent written and verbal communication skills, interpersonal and collaborative skills.
Other Requirements:
These are physical and mental requirements of the position as it is typically performed. Inability to meet one or more of these physical or mental requirements will not automatically disqualify a candidate or employee from the position. Upon request for a reasonable accommodation, the Company may be able to adjust or excuse one or more of these requirements, depending on the requirement, the essential functions to which it relates, and the proposed accommodation.
Physical Requirements: See; Color Perception; Hearing/Listening; Clear Speech; Manual Dexterity; Walk; Bend; Reach; Lifting - 25 Pounds; Sit, Stand.
Mental/Reasoning Requirements: Reading-Complex; Writing- Complex; Clerical; Basic Math Skills; Analysis/Comprehension, Judgment/Decision Making
Work Environment: Works Alone; Works with Others; Verbal Contact with Others; Face to Face Contact; Electrical Equipment;
The above statements are intended to describe the general nature and level of work being performed by employees assigned to this classification. They are not intended to be construed as an exhaustive list of all responsibilities, duties and/or skills required for this position.
Bell Partners, Inc. (“BPI” or the “Company”) is an equal employment opportunity employer. BPI’s policy is not to discriminate against any applicant or employee based on race, color, sex, religion, national origin, age, disability, pregnancy, military/veteran status, marital status, genetic information, gender identity, sexual orientation or any other basis protected by applicable federal, state, or local laws. BPI also prohibits harassment of applicants or employees based on any of these protected categories. It is BPI’s policy to comply with all applicable state and federal laws respecting consideration of unemployment status in making hiring decisions.
Note to Applicants: Smoking is prohibited in all indoor areas of Bell Partners Inc. unless designated smoking areas have been established by a particular location in accordance with applicable state and local law.",3.6,"Bell Partners
3.6","Raleigh, NC",-1,1001 to 5000 Employees,1976,Company - Private,Real Estate,Real Estate,$50 to $100 million (USD),-1
Data Scientist,$97K - $155K (Glassdoor est.),"At American Family Insurance, we believe people are an organization’s most valuable asset, and their ideas and experiences matter. From our CEO to our agency force, we’re committed to growing a diverse and inclusive culture that empowers innovation that will inspire, protect, and restore our customers’ dreams in ways never imagined.

American Family Insurance is driven by our customers and employees. That’s why we provide more than just a job – we provide opportunity. Whether you’re already part of our team in search of a new challenge or new to our company and ready for what’s next, you’re in the right place. Every dream is a journey that starts with a single step. Start your journey right here. Join our team. Bring your dreams.
Job ID:
R19602 Data Scientist (Open)
Summary:
Join the Machine Learning Research Team at American Family Insurance. The vision of this group is to provide innovative enterprise solutions inspired by ML, AI & data science through state-of-the-art research & assimilation. The research approach combines the art of the possible, product design, enterprise collaboration, and the research community. Research pillars include: Human in the Loop, Document Intelligence, Aerial Imagery, Process Optimization, AI-Based Data Management, & Knowledge Management. External Research Partnerships include: Mila, NIU, Stanford Data Science Consortium, The University of Chicago, National Robotics Engineering Center, and the American Family Insurance Data Science Institute at the University of Wisconsin.

For more information on the team, please visit: https://www.ai-ml-amfam.com/

Job Description:
Primary Accountabilities
Keeping abreast with latest advance of the research, tools and datasets of machine learning, deep learning and artificial intelligence. Be able to rapidly prototyping and testing innovative hypothesis. The resulted experiments and discoveries are of publication quality. Proactively lead and participate the publication processes.
Leveraging machine learning, predictive modeling and operational research across a variety of problem domains or business initiatives in insurance, to support business partner objectives and business needs.
Working with business partners, both internal and external, to identify new opportunities and challenges. Proactively brings in new and innovative ideas and approaches to develop business solutions. Working with business partners to develop problem definition, analytical approach, and research design for modeling projects.
Working with product managers and engineering teams to accelerate the process from research proof of concept to product delivery.
Working with business partners to develop problem definition, analytical approach, and research design for modeling projects.
Representing team to coordinate and support internal and external machine learning research partners and projects
Travel Requirements
This position requires travel up to 10% of the time.
Education and Licenses
Master’s Degree in Mathematics, Statistics, Physics, Computer Sciences or Engineering, or related quantitative fields or equivalent experience. PhD degree is a plus.
Specialized Knowledge and Skills Requirements
Ability to work as part of a team and to communicate effectively.
Demonstrated Verbal and Written communication abilities for presentations and publications
Demonstrated solid fundamentals in machine learning
Demonstrated proficiency with python, scikit learn, tensorflow, pytorch or one of similar machine learning and deep learning prototyping framework. Familiarity with version control for software development.
Demonstrated strong willingness and capabilities to learn new technologies and to innovate in the machine learning space.
Knowledge of the following areas is a plus:
Knowledge Graph and representation learning
NLP and language models
Object detection and Computer Vision models
Speech to text transcription
Bandits algorithms and Reinforcement learning
Other topics including meta learning, network quantization and pruning
Project experiences of implementing AI technologies in real world applications is a plus
Track record of publications is a plus
Experience with access, manipulation and statistical analysis of large data sets is a plus.
Experience with AWS, GCP and cloud computing is a plus
Experience with software development and agile methodologies is a plus
Additional Job Information:
Depending on qualifications, candidates may be considered at different levels.
Offer to selected candidate will be made contingent on the results of applicable background checks.
Offer to selected candidate is contingent on signing a non-disclosure agreement for proprietary information, trade secrets, and inventions.
We are open to hiring candidates to work remotely (anywhere in the USA). However, we are also open to candidates who will relocate to our headquarters location of Madison, WI or in our Seattle, WA or Chicago, IL locations. Relocation assistance may be available.
#LI-Remote
#IndeedLow
Stay connected: Join Our Enterprise Talent Community !
LI:DB1",3.7,"American Family Insurance
3.7","Madison, WI",-1,5001 to 10000 Employees,1927,Company - Private,Insurance Carriers,Insurance,$5 to $10 billion (USD),-1
Data Scientist,$93K - $152K (Glassdoor est.),"AIS has a workshare opportunity for a Data Scientist (TS/FSPOLY required) on a large, newly awarded contract. In this role you will develop machine learning, data mining, statistical and graph-based algorithms to analyze and make sense of datasets; prototype or consider several algorithms and decide upon final model based on suitable performance metrics.
Roles and Responsibilities:
Produce data visualizations that provide insight into dataset structure and meaning
Work with subject matters experts (SMEs) to identify important information in raw data and
develop scripts that extract this information from a variety of data formats (e.g., SQL tables, structured metadata, network logs)
Incorporate SME input into feature vectors suitable for analytic development and testing
Translate customer qualitative analysis process and goals into quantitative formulations that are coded into software prototypes
Develop and implement statistical, machine learning, and heuristic techniques to create descriptive,
predictive, and prescriptive analytics
Develop statistical tests to make data-driven recommendations and decisions
Develop experiments to collect data or models to simulate data when required data are unavailable
Develop feature vectors for input into machine learning algorithms
Identify the most appropriate algorithm for a given dataset and tune input and model parameters
Evaluate and validate the performance of analytics using standard techniques and metrics (e.g.cross-validation, ROC curves, confusion matrices)
Required Education, Experience and Skills
Master's degree in a quantitative discipline(e.g., statistics, mathematics, operations research, engineering, or computer science).
A Ph.D. in a quantitative discipline can be substituted for three years of experience
Five years of experience analyzing datasets and developing analytics.
Five years of experience programming with data analysis software such as R, Python, SAS, or MATLAB.
An additional two years of experience in software development, cloud development, analyzing datasets or developing descriptive, predictive, and prescriptive analytics can be substituted for a Master's degree.
U.S. Citizenship Required
Must possess a TS/FSPOLY clearance
EOE/AA Disability/Veteran",4.4,"Assured Information Security, Inc. (AIS)
4.4","Fort Meade, MD",-1,201 to 500 Employees,2001,Company - Private,Computer Hardware & Software,Information Technology,$100 to $500 million (USD),-1
Senior Data Scientist,-1,"About Fracta
Fracta.ai usesmachine learning and big data to optimize infrastructure investments – starting with water pipe network replacement solutions for water utilities worldwide. Our mission is to help utilities manage and conserve resources through the creation of intelligent infrastructure. Fracta gives utility companies the most comprehensive view of conditions, allowing them to optimize replacement decisions and reduce costs by as much as 40 percent.
About the Role
We are looking for a results-driven, motivated Senior Data Scientist who is passionate about creating world-class machine learning models and predictions. This is a very senior role which will allow you to test innovative techniques and models to improve the accuracy of our core algorithm and create a huge impact at the company. It is a role which requires creativity and a keen ability to solve difficult data problems. We take personal development seriously, so all members of the data science team receive mentoring and opportunities to grow in their careers.
Required Qualifications
Strong knowledge and experience in implementing machine learning in real-world applications – minimum 3 years of experience. Experience with structured data.
Knowledge and ability to deal with challenging data problems such as data mining, feature definition and ML-based data cleaning.
Demonstrated ability to work with highly imbalanced data sets
Experience working with data in a cloud-based application (AWS, GCP, Azure)
Knowledge of Python required, PyTorch and SQL (BigQuery) preferred
Team player: able to solve problems as part of a team and coach junior engineers
Desire and ability to work in a fast-paced, results-oriented start-up
Position is based downtown Redwood City, CA, right by the Caltrain station.
Job Type: Full-time
Pay: From $100,000.00 per year
COVID-19 considerations:
We have COVID-19 procedures in place for the office.",-1,Fracta,"Redwood City, CA",-1,-1,-1,-1,-1,-1,-1,-1
