Job Title,Salary Estimate,Job Description,Rating,Company Name,Location,Headquarters,Size,Founded,Type of ownership,Industry,Sector,Revenue,Competitors
"Senior Data Scientist , Advanced Analytics",$123K - $199K (Glassdoor est.),"Senior Data Scientist
Raytheon Missiles & Defense (RMD)
Digital Technology, Advanced Analytics
Andover, MA

Are you a self-driven problem solver and continuous learner with a passion for data, applied statistics, machine learning, programming and visualization? If so, you might be interested in the opportunity to join RMD’s Digital Technology Advanced Analytics team as a Data Scientist.

RMD seeks an entrepreneurial analyst capable of working across functional areas with minimal supervision in order to support the application of data science / software engineering methods and techniques for production scale internal use and external research. The successful candidate will work with stakeholders and the Advanced Analytics team to develop analytic products for agile delivery. Products will span manufacturing, engineering, business development, supply chain, and quality control functions.

At RMD, we work together as one global team creating trusted, innovative solutions to make the world a safer place. Our innovation spans all domains: from land and sea to air, space and cyberspace. We’re inspired by a noble mission that’s shared by RMD employees around the globe and an inclusive culture that empowers employees and celebrates their contributions.

This role will be based in Andover, MA. Please note that limited capped budget relocation support will be provided to the selected applicant if they are eligible per company policy. The amount will be discussed at the appropriate stage of our process.

Required Skills:
Demonstrated experience meeting with business stakeholders to identify and develop requirements for strategic use cases and research and development opportunities
Specific use and application of Python (numpy, scipy, pandas, scikit-image, and scikit-learn) to statistical and/or machine learning applications beyond academic examples
Effectively communicate statistical/mathematical techniques to non-technical audiences and senior leadership
Collaborate with data owners and technology teams to source data sets required for analyses
Apply quantitative techniques (normalization, applied statistics) to cleanse and explore large, complex data sets in preparation for further analysis
Apply data reduction, feature selection, and feature engineering techniques
Develop and implement hypothesis tests
Review, enhance, and quality assure operationalized algorithms and models
Iterate on and/or create repeatable, reusable processes and scalable data products with the advanced analytics team
Maintain contemporary expertise on new data science methods, technologies, industry trends and open source packages
Eligibility to obtain a US Govt. Dept. of Defense Secret Clearance as necessary for future projects that require it. Except in rare cases, only US Citizens are eligible to obtain US Clearances.
Desired Skills:
Proficiency with at least one deep learning framework such as PyTorch, TensorFlow, Keras, Theano or Caffe
It is important that candidates demonstrate the ability to articulate application of said skills to business results rather than purely academic endeavors.
Familiarity with CNN architectures such as ResNet, Inception, XCeption, NASNet, VGG, UNet, Stacked Hourglass, MobileNet, pix2pix, and CycleGAN
Experience with data visualization applications such as Tableau, Microsoft PowerBI, SAP Lumira, etc.
Ability and eagerness to learn, educate and mentor others
Experience in diverse domains (manufacturing operations, supply chain, finance, engineering, information technology, business development, quality control)
Experience with commercial software development processes: good software hygiene regarding code documentation, unit testing, bug tracking and version control
Familiarity deploying machine learning models in public cloud services such as AWS, Azure, or Google Cloud Platform
Track record of GPU programming, network optimization and deployment for data science applications
Required Education (including Major):
Bachelor’s or higher degree in Statistics, Econometrics, Engineering, Computer Science, Finance, Mathematics or a quantitative degree in other social science or hard science fields

This position requires either a U.S. Person or a Non-U.S. Person who is eligible to obtain any required Export Authorization and required US Security Clearance.
166749
Raytheon Technologies is an Equal Opportunity/Affirmative Action employer. All qualified applicants will receive consideration for employment without regard to race, age, color, religion, creed, sex, sexual orientation, gender identity, national origin, disability, or protected Veteran status.",3.8,"Raytheon Missiles & Defense
3.8","Andover, MA",-1,10000+ Employees,2020,Company - Public,Aerospace & Defense,Aerospace & Defense,$10+ billion (USD),-1
Data Scientist 2,$52K - $95K (Glassdoor est.),"Description
Digital Health and Analytics within Humana is dedicated to transform members’ health experience and Humana’s services using technology and analytics. We are looking for a Data Scientist 2 who will design studies and utilize cutting-edge predictive modeling techniques, test rigorous hypotheses, and turn data and insights into actionable plans. Being part of talented team of data scientists with broad skills and applications, the Data Scientist will work cross-functionally and collaboratively with teams across the enterprise through innovative R&D, machine learning, and cutting-edge platforms. The scope of our work includes forecasting, predictive modeling, designing business experiments, and ROI studies. The ideal candidate will have hands-on experience on healthcare data, demonstrated innovative and creative methods for overcoming testing constraints, as well as successfully applying machine learning techniques to address business needs.
Responsibilities
The Data Scientist 2 develops, maintains, and collects structured and unstructured data sets for analysis and reporting. Creates reports, projections, models, and presentations to support business strategy and tactics. Understands department, segment, and organizational strategy and operating objectives, including their linkages to related areas. Makes decisions regarding own work methods, occasionally in ambiguous situations, and requires minimal direction and receives guidance where needed. Follows established guidelines/procedures.
Responsibilities
Develop and validate statistical forecasting models or predictive models and tools
Research and evaluate innovative analytical methodologies, approaches, and solutions
Collaborate with analytic and data teams to set objectives, approaches, and work plans
Interprets and communicates analytic results to analytical and non-analytical business partners
Understands department, segment, and organizational strategy and operating objectives, including their linkages to related areas
Make decisions regarding own work methods, occasionally in ambiguous situations, and requires minimal direction and receives guidance where needed

Required Qualifications
Master's Degree in a quantitative discipline, such as Computer Science, Mathematics or Statistics and/or related quantitative field
2+ years of experience in advanced data analytics
Demonstrated experience with SAS, SQL, MATLAB, DataRobot, Python or similar statistical and scripting tools
Experience developing and validating statistical forecasting models or predictive models
Experience interpreting and communicating analytic results to analytical and non-analytical business partners
Naturally curious and comfortable with ambiguity and demonstrate critical thinking
Clear and concise oral and written communication skills, with a proven ability to translate complex methodologies and analytical results to non-technical business insights
Strong interpersonal and consulting skills
Preferred Qualifications
PhD in a quantitative discipline, such as Computer Science, Mathematics or Statistics and/or related quantitative field
Healthcare or managed care experience
Experience building large-scale predictive models
Experience in Big Data environment specifically PySpark and/or Databricks
Experience in deep learning, natural language processing, and recommendation systems
Additional Information
This position is based on either Humana’s headquarters in Louisville-KY or Humana’s Studio-H in Boston-MA.
Scheduled Weekly Hours
40",3.9,"Humana
3.9","Louisville, KY",-1,10000+ Employees,1961,Company - Public,Insurance Carriers,Insurance,$10+ billion (USD),-1
Data Scientist - HCI,-1,"Data Scientist - HCI
Long Beach, CA
Full-time

About SCAN
As one of the nation’s largest not-for-profit Medicare Advantage plans, serving more than 200,000 members in California, SCAN Health Plan has been a mission-driven organization dedicated to keeping seniors healthy and independent for over 40 years. SCAN employees are passionate about what they do, and understand that success is based on achieving the mission. Employees are afforded with the training and tools necessary to do their jobs and are rewarded for their efforts and recognized as experts in their fields. To learn more, visit scanhealthplan.com or follow us on social media: LinkedIn; Facebook; and Twitter.

The Opportunity
The Data Scientist will support leadership and Healthcare Informatics teams with insights gained from analyzing company and external data to help make smarter decisions and drive better outcomes. You must be adept at using large data sets to find opportunities for quality improvement and process optimization. You must have strong experience using a variety of data mining/data analysis techniques, using a variety of data tools, building and implementing predictive models, using/creating algorithms upon structured and unstructured data. You must have a proven ability to drive business results with their data-driven insights. You must be comfortable working with a wide range of stakeholders and functional teams. The right candidate will have a passion for discovering solutions hidden in large data sets and working with stakeholders to improve business outcomes.

You Will
Work with stakeholders throughout the organization to identify opportunities for leveraging big data to drive business solutions.
Mine and analyze data (both structured and unstructured data) from company databases and external data when needed to drive quality improvement, process optimization and business strategies.
Select features, building and optimizing models using machine learning techniques.
Process, clean, and verify the integrity of data used for analysis.
Develop custom data models and algorithms to apply to data sets.
Use predictive models to increase and optimize intervention targeting, coding accuracy, and other business outcomes.
Do ad-hoc analysis and present results in a clear manner.
Coordinate with different functional teams to implement models and monitor outcomes.
Develop processes and tools to monitor and analyze model performance and data accuracy.

Your Qualifications
Master's Degree or PhD in Statistics, Mathematics, Computer Science, or another quantitative field.
3-5 years of experience handling data sets and building statistical/machine learning models
Excellent understanding of machine leaning techniques (clustering, decision tree learning, neural networks, etc.), the natural language processing techniques, and their real-world advantages/drawbacks.
Knowledge of advanced statistical techniques and concepts (regression, properties of distributions, statistical tests and proper usage, etc.) and experience with applications.
Experience with cloud computing is preferred, such as Microsoft Azure.
Experience using common data science toolkits (R, Python, SAS, etc.) to handle data and draw insights from large data sets. Excellence in at least one of these is highly desirable.
Proficiency in using query languages such as SQL.
Excellent written and verbal communication skills for coordinating across teams.
A drive to learn and master new technologies and techniques.

What's in it for you? Qualified employees will receive:
A competitive compensation and benefits program
An annual employee bonus program
Generous paid-time-off (PTO)
Ten paid holidays per year
Excellent 403(b) Saving Plan, providing up to 4% match and vesting after three years
Casual attire
A work-life balance and much more!

We're always looking for talented people to join our team! Qualified applicants are encouraged to apply now!

Equal Opportunity Employer/Protected Veterans/Individuals with Disabilities
The contractor will not discharge or in any other manner discriminate against employees or applicants because they have inquired about, discussed, or disclosed their own pay or the pay of another employee or applicant. However, employees who have access to the compensation information of other employees or applicants as a part of their essential job functions cannot disclose the pay of other employees or applicants to individuals who do not otherwise have access to compensation information, unless the disclosure is (a) in response to a formal complaint or charge, (b) in furtherance of an investigation, proceeding, hearing, or action, including an investigation conducted by the employer, or (c) consistent with the contractor’s legal duty to furnish information. 41 CFR 60-1.35(c)",-1,SCAN Group,"Long Beach, CA",-1,-1,-1,-1,-1,-1,-1,-1
Research Scientist/ Senior Research Scientist,$88K - $167K (Glassdoor est.),"Research Scientist/ Senior Research Scientist
AstraZeneca is a British-Swedish multinational pharmaceutical and biopharmaceutical company. Here, you'll have the opportunity to collaborate with renowned scientists to find the targets which are fundamental drivers of human disease. As one of the world's premier biotechnology companies, our mission is centered on groundbreaking, outstanding work that has a big impact on science and making a difference in people's lives every day.
What you’ll do
As a Senior Research Scientist in the COPD research team in the Respiratory and Immunology department (R&I) you will study the biology of human airway and alveolar epithelium with the focus on lung stem cells, immune cells, and pathogenesis of COPD disease. You will study growth factor pathways that regulate lung stem cell self-renewal and differentiation in health and disease, epithelial-mesenchymal and epithelial-immune interactions using patient airway models and patient-derived iPSCs at the tissue- and single-cell levels.
you will also provide scientific input to the early stage of research and development. This includes study design, analysis, and interpretation of preclinical data and mechanistic studies in human-based 3D culture systems or animal models.
Collaboration with colleagues within and beyond early R&I will be crucial for you to be successful in your role and you will work closely together with colleagues from Patient Safety, Discovery science, Translational science, and late R&I Groups.
We will rely on you to:
Lead and perform a range of lab-based experiments including generating 2D and 3D culture models, phenotyping diseased cells with cellular, molecular and functional assays.
Isolated and utilized epithelial cells and immune cells from patients samples
Make detailed observations, analyze data, and interpret results independently.
Preparation of precise technical summaries, protocols, quantitative analyses, and maintenance of appropriate documentation.
Oversee the day to day organization of different components of the projects.
Work collaboratively with other members of the teams who are working on related research questions.
Publish discoveries in high quality and impact journals.
Essential for the role:
Research Scientist
Ph.D. in the field of cell biology, Molecular biology , immunology or a related field with 3-4 years postdoc or industry experience
Senior Research Scientist
Ph.D. in the field of Cell biology, Immunology, Molecular biology or a related field with 5-6 years postdoc or industry experience
Additionally, you possess:
The knowledge of lung biology, physiology, and disease, epithelial, and mesenchymal biology.
Experience in stem cell culture and differentiation.
Strong cell biology experience in tissue culture techniques, isolation, and culture of primary cells and the use of co-culture systems.
Excellent skills in cellular and molecular biology techniques (Western blot, qRT-PCR, immunostaining, ELISA) and fluorescence imaging.
Excellent analytic and problem-solving skills.
Excellent written and verbal interpersonal skills and effective presentation of complex scientific data to cross-functional and senior management teams
Proven ability to work independently and in collaborative team environments
Desirable for the role
Experience in advanced 3D imaging and single-cell RNA seq analysis.
Experience in bioinformatics analysis and software
Experience in the development of the in-vitro disease model and in vivo mouse models and subsequent analysis, including but not limited to COPD is a plus.
Experience of leading and managing small group and cross-functional collaboration activities
At AstraZeneca when we see an opportunity for change, we seize it and make it happen, because any opportunity no matter how small, can be the start of something big. Delivering life-changing medicines is about being entrepreneurial - finding those moments and recognizing their potential. Join us on our journey of building a new kind of organization to reset expectations of what a bio-pharmaceutical company can be. This means we’re opening new ways to work, pioneering groundbreaking methods and bringing unexpected teams together. Interested? Come and join our journey!
So, what’s next!
If you are ready to make a difference - apply today, and we'll make it happen together!
We welcome your application no later than September 30th, 2020
Where can I find out more?
Follow AstraZeneca on LinkedIn https://www.linkedin.com/company/1603/
Follow AstraZeneca on Facebook https://www.facebook.com/astrazenecacareers/
Follow AstraZeneca on Instagram https://www.instagram.com/astrazeneca/
We are an equal opportunity employer and value diversity at our company. We do not discriminate on the basis of race, religion, color, national origin, gender, sexual orientation, age, marital status, veteran status, or disability status. We will ensure that individuals with disabilities are provided a reasonable accommodation to participate in the job application or interview process, to perform essential job functions, and to receive other benefits and privileges of employment. Please contact us to request accommodation.",4.2,"AstraZeneca
4.2","Gaithersburg, MD",-1,10000+ Employees,1913,Company - Public,Biotech & Pharmaceuticals,Biotech & Pharmaceuticals,$10+ billion (USD),-1
Junior Data Analyst,-1,"*
Chubb is seeking a creative, innovative, and collaborative Data Apprentice who is ambitious and hungry to learn. You will join the Analytics team and the digital professionals who are charged with ensuring Chubb thrives in the Digital Age. *WhiteHat is the training provider for this apprenticeship and Chubb is the employer*
*
A typical day
Communicating with both technical and non-technical groups on a regular basis to pass along important information.
Identifying business-specific rules related to datasets and data characteristics that will influence project design and analysis.
Describe the data analytics lifecycle and set out details, activities and roles at each stage in a real-world example.
Understand Data Science including programming basics, foundations of data modelling, research design and exploratory analysis, machine learning, and Big Data fundamentals.
Develop a solid working knowledge of how current systems and data sources are populated and sourced.
Assist in documentation of accuracy and availability of various data elements and variables.
Understanding normalized relational databases and understand how and why the principles are applied.
Identifying starting points for overcoming project and technical problems.
Implementing quality control measures and know how to assure the quality of data uploads and query output.
Understand data regulation and how it impacts your role.
Designing effective project briefs which communicate expectations to stakeholders.
You must have:
High School Diploma or GED
Be over the age of 18
Skills needed:
Individuals with an interest in math, science or technology. A desire to learn programming is a plus
Experience with Microsoft Office applications, especially Excel
Strong analytical background and a strong sense of personal ownership over work
Strong research capability
Excellent, clear and concise verbal and written communication skills
Self-motivated, passionate technical professional, driven to achieve committed milestones
Ability to multi-task and work independently with little supervision
Excellent attention to detail in a complex, deadline-oriented environment
Training required:
Training on the 12 month, fully employed Data Analytics apprenticeship.
Being a WhiteHat apprentice means access to awesome social events, sports teams, insight/career days with other apprentices to grow your network, as well as your own personal Coach who will guide you through the qualification to help you achieve your full potential.
As part of your WhiteHat Apprenticeship, you will have access to our Future Leaders Foundation modules to develop 6 key competencies, underpinned by well-being, self-awareness, motivation, conscientiousness, effectiveness and grit.
Future prospects
After your Data Analysis Apprenticeship, you can progress into any Junior Data Analyst, Data Scientist and Data engineer role. You'll have the skills to run insight analytical projects from beginning to end and work within a Data Analytics team.
Job Types: Full-time, Contract
Salary: $17.00 per hour
Schedule:
Monday to Friday
Education:
High school or equivalent (Preferred)
Contract Renewal:
Possible
Work Location:
One location
This Company Describes Its Culture as:
Detail-oriented -- quality and precision-focused
Innovative -- innovative and risk-taking
Team-oriented -- cooperative and collaborative
Company's website:
https://www.chubb.com/us-en/
Company's Facebook page:
https://www.facebook.com/ChubbGlobal/
Work Remotely:
Temporarily due to COVID-19
COVID-19 Precaution(s):
Remote interview process",-1,WhiteHat,"Jersey City, NJ",-1,-1,-1,-1,-1,-1,-1,-1
